product_slug,description_p1,description_p2,description_p3,purity,form,storage,molecular_weight,cas_number,sequence,origin,solubility,research_category,seo_title,seo_description,faq_1_q,faq_1_a,faq_2_q,faq_2_a,faq_3_q,faq_3_a,faq_4_q,faq_4_a,faq_5_q,faq_5_a,ref_1,ref_2,ref_3
cjc-1295-with-dac,"CJC-1295 with DAC is a synthetic analog of human growth hormone-releasing hormone (GHRH) (1–29) that incorporates a drug affinity complex (DAC) moiety to enable covalent binding to serum albumin. The peptide backbone is a modified GHRH(1–29) sequence (e.g., Tyr‑D‑Ala‑Asp‑Ala‑Ile‑Phe‑Thr‑Gln‑Ser‑Tyr‑Arg‑Lys‑Val‑Leu‑Ala‑Gln‑Leu‑Ser‑Ala‑Arg‑Lys‑Leu‑…) with empirical formula C165H269N47O46 reported for the DAC-conjugated form. The DAC group is typically attached via a lysine side chain to form a stable albumin-reactive entity.","CJC-1295 DAC is used as a long-acting GHRH analog in in‑vitro and in‑vivo models examining class B GHRH receptor pharmacology and growth hormone secretagogue signalling. It serves as a reference compound in studies of receptor binding, cAMP generation, and pharmacokinetic extension via albumin bioconjugation.","Research-grade CJC-1295 DAC is supplied as a lyophilized peptide at ≥98% purity by HPLC, typically as an acetate or trifluoroacetate salt. The material is reconstituted in sterile water or aqueous buffer immediately prior to use and stored lyophilized at −20°C, with reconstituted aliquots kept frozen and protected from light. Reference standard for in-vitro research on GHRH receptor signalling and albumin bioconjugation strategies. For Research Use Only. Not for human consumption. Not intended for therapeutic, diagnostic, or clinical use.",≥98% HPLC,Lyophilized peptide,-20°C lyophilized; -20°C reconstituted; protect from light,,863288-34-0,Modified GHRH(1–29) peptide with albumin-binding DAC moiety,Synthetic,"Water, aqueous buffers",GHRH analog peptide,CJC-1295 DAC Reference Standard | GHRH Analog,Long-acting GHRH(1–29) analog with DAC for in-vitro studies of growth hormone secretagogue receptor signalling. ≥98% HPLC. RUO.,What is the structural relationship between CJC-1295 DAC and native GHRH?,CJC-1295 DAC is based on the 1–29 N-terminal fragment of human GHRH with sequence modifications and an added drug affinity complex that enables albumin binding.,Why is the DAC group incorporated into CJC-1295?,"The DAC moiety forms covalent or quasi-covalent bonds with circulating albumin, extending the peptide's residence time and enabling long-acting receptor engagement in preclinical models.",How is CJC-1295 DAC typically formulated for research?,"Vendors supply CJC-1295 DAC as a lyophilized, high-purity peptide salt intended for reconstitution in aqueous media for biochemical and cell-based assays.",,,,,Wikipedia. CJC-1295 – long-acting GHRH analog with DAC.,"Particle Peptides safety data sheet for CJC-1295 + DAC, listing CAS 863288-34-0 and peptide formula.",
ipamorelin,"Ipamorelin is a synthetic pentapeptide with the sequence Aib‑His‑D‑2‑Nal‑D‑Phe‑Lys‑NH2, where Aib is α‑aminoisobutyric acid and 2‑Nal is 3‑(2‑naphthyl)‑D‑alanine. It has the empirical formula C38H49N9O5 and a molecular weight of approximately 711.85 Da. Ipamorelin is a highly selective agonist of the ghrelin/growth hormone secretagogue receptor (GHSR‑1a) and belongs to the class of non‑endogenous growth hormone secretagogues.","In research, ipamorelin is widely used as a reference GHSR agonist in in‑vitro assays and ex‑vivo pituitary or hypothalamic systems. It is applied in binding, calcium-flux, and cAMP assays, as well as in perfused organ and animal models studying growth hormone secretagogue receptor signalling.","Research-grade ipamorelin is provided mainly as the acetate salt in lyophilized form with purity ≥98% by HPLC. It shows good stability when stored at −20°C protected from light and moisture, and is typically reconstituted in water, dilute acids, or mixed aqueous–organic solvents for experimental use. Reference standard for in-vitro research on ghrelin/growth hormone secretagogue receptor pathways. For Research Use Only. Not for human consumption. Not intended for therapeutic, diagnostic, or clinical use.",≥98% HPLC,Lyophilized acetate salt,-20°C; protect from light and moisture,711.85 Da,170851-70-4,Aib-His-D-2-Nal-D-Phe-Lys-NH2,Synthetic,"Water (slight), acetic acid (dilute), aqueous-organic mixtures",GHSR agonist peptide,Ipamorelin Reference Standard | GHSR Peptide,Pentapeptide GHSR agonist (Aib-His-D-2-Nal-D-Phe-Lys-NH2) for in-vitro growth hormone secretagogue receptor research. ≥98% HPLC. RUO.,What receptor does ipamorelin target in research models?,Ipamorelin is a selective agonist at the ghrelin/growth hormone secretagogue receptor GHSR‑1a and is used to study this receptor's signalling in vitro.,What is the amino acid composition of ipamorelin?,"It is a pentapeptide composed of Aib, His, D‑2‑Nal, D‑Phe, and Lys, with a C‑terminal amide.",How is ipamorelin typically supplied for laboratory use?,"Vendors offer ipamorelin predominantly as a lyophilized acetate salt with ≥98% HPLC purity, intended for reconstitution immediately before experiments.",,,,,"ChemicalBook entry for Ipamorelin, CAS 170851-70-4, including formula and sequence.","CymitQuimica technical description of Ipamorelin, listing formula and molecular weight.",
5-amino-1mq,5-Amino-1MQ is a synthetic small-molecule research probe belonging to the quaternary quinolinium class. It is commonly referenced by the cation name 5-amino-1-methylquinolinium (C10H11N2+) and is frequently supplied as an iodide salt (C10H11IN2) with CAS number 42464-96-0. The compound has been discussed in preclinical literature as a substrate-site–targeting inhibitor candidate for nicotinamide N‑methyltransferase (NNMT).,"In vitro, 5-Amino-1MQ is used as a reference NNMT-modulating small molecule in enzymatic assays, metabolite profiling workflows, and pathway studies assessing methylation-related biochemical readouts. It is applied in cell-free and cell-based systems interrogating NNMT activity and downstream metabolite changes in controlled experimental settings.","Research-grade 5-Amino-1MQ iodide is typically supplied as a solid powder with ≥98% HPLC purity. It is soluble in polar solvents such as water and DMSO, and stability data and catalog guidance recommend storage at −20°C in a dry environment to preserve integrity. Reference standard for in-vitro research on NNMT-associated biochemical pathways. For Research Use Only. Not for human consumption. Not intended for therapeutic, diagnostic, or clinical use.",≥98% HPLC,Solid powder (iodide salt),-20°C; dry; protect from light,~286.1 Da (iodide salt form),42464-96-0,,Synthetic,"Water, DMSO, polar organic solvents",Small-molecule NNMT probe,5-Amino-1MQ Reference Standard | NNMT Probe,Quinolinium NNMT research probe (5-Amino-1-methylquinolinium iodide) for in-vitro nicotinamide N-methyltransferase pathway studies. ≥98% HPLC. RUO.,What is the preferred chemical form of 5-Amino-1MQ for research use?,"Many catalogs provide the iodide salt of 5-amino-1-methylquinolinium, which offers defined composition and good aqueous solubility.",What enzyme system is commonly interrogated with 5-Amino-1MQ?,5-Amino-1MQ is used in in‑vitro assays of nicotinamide N‑methyltransferase (NNMT) to explore substrate-site modulation and downstream metabolite shifts.,Are there public database entries for 5-Amino-1MQ?,"Yes. The cation and its salt forms appear in PubChem (e.g., CID 950107) and commercial chemical databases with structural and analytical data.",,,,,"BlkcellResearch technical monograph for 5-Amino-1MQ, summarizing NNMT probe usage and identifiers.","ChemicalBook entry for 5-amino-1-methylquinolinium chloride/iodide, CAS 42464-96-0.",
nad-plus,"NAD+ (nicotinamide adenine dinucleotide, oxidized form) is a ubiquitous pyridine nucleotide cofactor composed of an adenosine diphosphate ribose moiety linked via pyrophosphate to nicotinamide riboside. The oxidized species has empirical formula C21H26N7O14P2− (for the anionic form) and a molecular weight around 662.4 g/mol. NAD+ participates in redox reactions as an electron acceptor and is central to dehydrogenase-catalyzed metabolic transformations in biochemical systems.","In research, NAD+ is used as a reference cofactor in enzyme-kinetic assays, mitochondrial function studies, and in‑vitro models of energy metabolism. It is routinely employed in spectrophotometric dehydrogenase assays, sirtuin activity measurements, and other in‑vitro systems that require defined pyridine nucleotide pools.","Research-grade NAD+ is typically supplied as the disodium or free acid salt in lyophilized powder form with ≥98% purity. It is highly water-soluble and generally stored at −20°C in sealed containers protected from moisture and repeated freeze–thaw; reconstituted solutions are kept refrigerated or frozen depending on experimental timelines. Reference standard for in-vitro research on redox biochemistry and pyridine-nucleotide–dependent metabolic pathways. For Research Use Only. Not for human consumption. Not intended for therapeutic, diagnostic, or clinical use.",≥98% (HPLC or enzymatic assay),Lyophilized powder (often disodium salt),-20°C; dry; protect from moisture and light,662.4 Da,,,Synthetic or fermentation-derived,Water,Pyridine nucleotide cofactor,NAD+ Reference Standard | Pyridine Nucleotide,"Oxidized nicotinamide adenine dinucleotide cofactor for in-vitro redox enzyme and metabolic pathway studies. Lyophilized, ≥98% purity. RUO.",What is the primary chemical role of NAD+ in research assays?,"NAD+ acts as an oxidizing cofactor, accepting hydride equivalents in dehydrogenase and related enzyme reactions during in‑vitro kinetic studies.",In which assay formats is NAD+ most frequently used?,"It is a standard component in spectrophotometric dehydrogenase assays, mitochondrial respiration studies, and diverse enzyme systems requiring defined pyridine nucleotide concentrations.",How is research-grade NAD+ typically formulated and stored?,Vendors supply NAD+ as a lyophilized powder that is reconstituted with water immediately before use and stored at low temperature in the dark to limit degradation.,,,,,PubChem CID 15938971. Nad+. National Center for Biotechnology Information.,PubChem entries for nicotinamide–adenine dinucleotide and Nadide.,
semax,Semax is a synthetic heptapeptide analogue of the adrenocorticotropic hormone fragment ACTH(4–10) with the sequence Met‑Glu‑His‑Phe‑Pro‑Gly‑Pro (MEHFPGP). It preserves the core ACTH(4–7) sequence and incorporates an additional Pro‑Gly‑Pro motif at the C‑terminus. The peptide has been characterized as a regulatory neuropeptide analog with high affinity for copper(II) ions in solution.,"Semax is used as a reference ACTH-derived peptide in in‑vitro and ex‑vivo models investigating neuropeptide signalling, neurotrophin expression, and metal-ion–associated oxidative processes. It has been studied in cell cultures for its interactions with copper(II) and for effects on viability under metal-induced stress conditions.","Research-grade semax is supplied as a lyophilized acetate salt at ≥98% HPLC purity for experimental work. It is water-soluble and generally stored at −20°C protected from light, with reconstituted solutions maintained at low temperature and used promptly. Reference standard for in-vitro research on ACTH-fragment neuropeptides, metal–peptide interactions, and neurotrophin-related pathways. For Research Use Only. Not for human consumption. Not intended for therapeutic, diagnostic, or clinical use.",≥98% HPLC,Lyophilized acetate salt,-20°C lyophilized; -20°C reconstituted; protect from light,~868 Da,80714-61-0,MEHFPGP (Met-Glu-His-Phe-Pro-Gly-Pro),Synthetic,"Water, aqueous buffers",ACTH-fragment peptide,Semax Reference Standard | ACTH Fragment Peptide,"Heptapeptide ACTH(4–10) analog (MEHFPGP) for in-vitro neuropeptide and metal–peptide signalling research. Lyophilized, ≥98% HPLC. RUO.",What is the sequence origin of Semax?,"Semax is derived from the ACTH(4–10) fragment and extended with a C‑terminal Pro‑Gly‑Pro motif, yielding the heptapeptide MEHFPGP.",Which experimental systems commonly employ Semax?,"It is used in neuronal and glial cell models, as well as biochemical systems, to study neuropeptide signalling and copper(II)-associated oxidative stress responses.",Does Semax form complexes with metal ions?,"Yes. A detailed study reported high-affinity complexation of Semax with Cu(II) in solution, associated with protective effects in metal-induced toxicity models.",,,,,Wikipedia. Semax – ACTH(4–10) analog with sequence MEHFPGP.,"Palacios C. et al., 2015. Semax, an ACTH 4–10 peptide analog with high affinity for copper(II) ion and protective ability against metal-induced cell toxicity. J Inorg Biochem.",
selank,"Selank is a synthetic heptapeptide with the sequence Thr‑Lys‑Pro‑Arg‑Pro‑Gly‑Pro (TKPRPGP), designed as an analog of the endogenous tetrapeptide tuftsin (Thr‑Lys‑Pro‑Arg). The C‑terminal Pro‑Gly‑Pro extension enhances peptide stability while preserving the tuftsin motif. Selank is classified as a regulatory neuropeptide analog in the Russian peptide literature.","Selank is used as a reference peptide in in‑vitro and animal models assessing neuropeptide signalling, synaptic plasticity markers, and neurotrophin expression. It has been examined in systems measuring brain-derived neurotrophic factor (BDNF) expression and in receptor-binding or gene-expression assays relevant to stress-response pathways.","Research-grade Selank is supplied as a lyophilized acetate salt with typical purity ≥98% by HPLC. It is soluble in water and aqueous buffers and is stored at −20°C protected from light and moisture; reconstituted solutions are kept refrigerated or frozen according to experimental schedules. Reference standard for in-vitro research on tuftsin-related neuropeptides and BDNF-associated signalling pathways. For Research Use Only. Not for human consumption. Not intended for therapeutic, diagnostic, or clinical use.",≥98% HPLC,Lyophilized acetate salt,-20°C lyophilized; -20°C reconstituted; protect from light,~863 Da,129954-34-3,TKPRPGP (Thr-Lys-Pro-Arg-Pro-Gly-Pro),Synthetic,"Water, aqueous buffers",Tuftsin analog peptide,Selank Reference Standard | Tuftsin Analog Peptide,"Heptapeptide tuftsin analog (TKPRPGP) for in-vitro neuropeptide and BDNF-pathway research. Lyophilized acetate salt, ≥98% HPLC. RUO.",What structural motif does Selank contain?,"Selank contains the tuftsin tetrapeptide Thr‑Lys‑Pro‑Arg extended by Pro‑Gly‑Pro at the C‑terminus, improving stability while preserving the core motif.",What research areas commonly employ Selank?,"It is used in neurobiology models studying neuropeptide signalling, BDNF expression, and gene-expression changes associated with stress-response pathways.",How is Selank typically formulated?,"Vendors provide Selank as a lyophilized acetate salt of ≥98% purity, intended for reconstitution in water or buffer prior to in‑vitro or preclinical use.",,,,,Wikipedia. Selank – heptapeptide tuftsin analog TKPRPGP.,"ChemicalBook entry for Selank peptide, CAS 129954-34-3.",
kisspeptin-10,"Kisspeptin-10 (KP‑10) is a decapeptide fragment of the human KISS1 gene product, corresponding to residues 45–54 (Metastin 45–54) with the sequence Tyr‑Asn‑Trp‑Asn‑Ser‑Phe‑Gly‑Leu‑Arg‑Phe‑NH2 (YNWNSFGLRF‑NH2). It has the empirical formula C63H83N17O14 and a molecular weight of approximately 1302.4 g/mol. Kisspeptin‑10 is a high-affinity ligand for the G protein–coupled receptor KISS1R (GPR54), which plays a key role in the hypothalamic–pituitary–gonadal axis.","In vitro, kisspeptin‑10 is widely used as a reference peptide in receptor-binding, calcium-mobilization, and cAMP signalling assays in KISS1R‑expressing cell systems. It is also applied in pituitary and hypothalamic models exploring GnRH neuron activation and downstream gonadotropin-related pathways.","Research-grade kisspeptin‑10 is supplied as a lyophilized acetate or trifluoroacetate salt with ≥98% HPLC purity. It is soluble in water and dilute acetic acid, and is stored at −20°C protected from light; once reconstituted, aliquots are typically frozen to maintain peptide stability. Reference standard for in-vitro research on KISS1R signalling and hypothalamic–pituitary–gonadal axis regulation. For Research Use Only. Not for human consumption. Not intended for therapeutic, diagnostic, or clinical use.",≥98% HPLC,Lyophilized peptide (acetate or TFA salt),-20°C lyophilized; -20°C reconstituted; protect from light,1302.4 Da,374675-21-5,YNWNSFGLRF-NH2,Synthetic,"Water, dilute acetic acid",Kisspeptin peptide,Kisspeptin-10 Reference Standard | KISS1R Peptide,Decapeptide KISS1R ligand (YNWNSFGLRF-NH2) for in-vitro GnRH neuron and hypothalamic–pituitary–gonadal signalling research. ≥98% HPLC. RUO.,What is the sequence of kisspeptin‑10?,The human KP‑10 sequence is Tyr‑Asn‑Trp‑Asn‑Ser‑Phe‑Gly‑Leu‑Arg‑Phe‑NH2 (YNWNSFGLRF‑NH2).,Which receptor does kisspeptin‑10 activate in research systems?,Kisspeptin‑10 is a high-affinity agonist of KISS1R (GPR54) and is commonly used to probe this receptor's signalling in vitro.,How is kisspeptin‑10 typically used in endocrine research?,It is employed in pituitary and hypothalamic models to study GnRH neuron activation and related hypothalamic–pituitary–gonadal axis signalling.,,,,,PubChem CID 25240297. Kisspeptin-10. National Center for Biotechnology Information.,"Dhillo W.S. et al., 2011. Kisspeptin‑10 is a potent stimulator of LH and increases pulse frequency. J Clin Endocrinol Metab.",
oxytocin,"Oxytocin is a cyclic nonapeptide hormone and neuropeptide with the sequence Cys‑Tyr‑Ile‑Gln‑Asn‑Cys‑Pro‑Leu‑Gly‑NH2 (CYIQNCPLG‑NH2), featuring a disulfide bridge between Cys1 and Cys6. It has the empirical formula C43H66N12O12S2 and is classified as a member of the vasopressin/oxytocin peptide family. Oxytocin acts via the oxytocin receptor (OXTR), a class A GPCR.","In research, oxytocin is used as a reference ligand in receptor-binding and functional assays investigating OXTR-mediated G‑protein signalling, intracellular calcium flux, and β‑arrestin recruitment. It is also applied in myometrial strip preparations, neuronal cultures, and ex‑vivo tissue systems to characterize oxytocin receptor pharmacology and downstream signalling cascades.","Research-grade oxytocin is supplied as a lyophilized peptide, often as an acetate salt, with ≥98% HPLC purity. It is readily soluble in water and dilute acids, and is stored at −20°C protected from light and moisture; reconstituted solutions are typically kept refrigerated or frozen and used within defined stability windows. Reference standard for in-vitro research on oxytocin receptor signalling and vasopressin/oxytocin-family neuropeptides. For Research Use Only. Not for human consumption. Not intended for therapeutic, diagnostic, or clinical use.",≥98% HPLC,Lyophilized peptide (often acetate salt),-20°C lyophilized; -20°C reconstituted; protect from light,~1007 Da,50-56-6,CYIQNCPLG-NH2 (disulfide bridge between Cys1–Cys6),Synthetic,"Water, dilute acetic acid",Neuropeptide hormone,Oxytocin Reference Standard | Neuropeptide Hormone,"Cyclic nonapeptide hormone (CYIQNCPLG-NH2) for in-vitro oxytocin receptor and vasopressin-family signalling research. Lyophilized, ≥98% HPLC. RUO.",What is the primary receptor target of oxytocin?,"Oxytocin is an endogenous ligand for the oxytocin receptor (OXTR), a G protein–coupled receptor studied in many biochemical and tissue-based assays.",What structural feature stabilizes oxytocin's conformation?,"A disulfide bridge between residues Cys1 and Cys6 cyclizes the peptide backbone, constraining its conformation.",How is oxytocin typically supplied for experimental use?,"It is sold as a lyophilized peptide of high purity, commonly as the acetate salt, for reconstitution in aqueous media before in‑vitro or ex‑vivo experiments.",,,,,PubChem substance record for oxytocin [USP:INN:BAN:JAN].,"CymitQuimica entry for oxytocin, CAS 50-56-6, with structural description.",
ll-37,"LL‑37 is a 37‑amino‑acid cationic α‑helical peptide generated by proteolytic processing of the human cathelicidin precursor hCAP‑18. Its sequence is LLGDFFRKSKEKIGKEFKRIVQRIKDFLRNLVPRTES, and it carries a net positive charge under physiological conditions. LL‑37 is the only human cathelicidin identified to date and is classified as an antimicrobial host-defense peptide.","In research, LL‑37 is widely used as a reference antimicrobial peptide in in‑vitro assays evaluating bactericidal activity, membrane permeabilization, and peptide–lipid interactions. It is also applied in studies of innate immune signalling, nucleic-acid complex formation, and cytokine induction in various cell types.","Research-grade LL‑37 is typically supplied as a lyophilized trifluoroacetate or acetate salt at ≥95–98% HPLC purity. It is soluble in water and aqueous buffers, especially at slightly acidic pH, and is stored at −20°C protected from light and moisture, with reconstituted aliquots maintained frozen to preserve activity. Reference standard for in-vitro research on antimicrobial host-defense peptides, membrane interactions, and innate immune signalling pathways. For Research Use Only. Not for human consumption. Not intended for therapeutic, diagnostic, or clinical use.",≥95–98% HPLC,Lyophilized peptide (acetate or TFA salt),-20°C lyophilized; -20°C reconstituted; protect from light,~4493 Da,,LLGDFFRKSKEKIGKEFKRIVQRIKDFLRNLVPRTES,Synthetic,"Water, aqueous buffers",Antimicrobial peptide,LL-37 Reference Standard | Human Cathelicidin Peptide,"Human cathelicidin peptide (37 aa) for in-vitro antimicrobial, membrane-interaction, and innate immune signalling research. Lyophilized. RUO.",What is LL‑37's sequence origin?,LL‑37 is derived from the C‑terminal region of the human cathelicidin precursor hCAP‑18 by proteolytic processing.,Which in-vitro assays commonly employ LL‑37?,"It is used in bacterial killing assays, liposome leakage experiments, and cell-based studies dissecting innate immune signalling and nucleic-acid complexation.",How is LL‑37 typically formulated for laboratory use?,Vendors supply LL‑37 as a lyophilized peptide salt of high purity that is reconstituted in water or buffer immediately before antimicrobial and mechanistic assays.,,,,,Wikipedia. Cathelicidin antimicrobial peptide – LL‑37 overview.,"Nijnik A. et al., 2013. The human cathelicidin LL-37 as a multifunctional peptide in infection and inflammation. Expert Rev Anti Infect Ther.",
kpv,KPV is a tripeptide corresponding to residues 11–13 of α‑melanocyte-stimulating hormone (α‑MSH) with the sequence Lys‑Pro‑Val (H‑Lys‑Pro‑Val‑OH). It has the empirical formula C16H30N4O4 and a molecular weight of approximately 342.43 g/mol. KPV retains the C‑terminal motif of α‑MSH and is categorized as a melanocortin-related peptide fragment in the experimental peptide literature.,"In research, KPV is used as a reference peptide in in‑vitro models studying melanocortin receptor signalling and inflammatory pathway markers. It has been examined in cell and tissue systems for its effects on cytokine readouts, NF‑κB pathway components, and epithelial barrier-associated parameters in controlled experimental contexts.","Research-grade KPV is supplied as a lyophilized peptide at ≥95–98% HPLC purity. It is highly hydrophilic and soluble in water and aqueous buffers, and is stored at −20°C protected from light and moisture; reconstituted solutions are typically aliquoted and frozen to maintain stability. Reference standard for in-vitro research on melanocortin-related peptides and inflammatory-signalling pathways. For Research Use Only. Not for human consumption. Not intended for therapeutic, diagnostic, or clinical use.",≥95–98% HPLC,Lyophilized powder,-20°C; protect from light and moisture,342.43 Da,,KPV (Lys-Pro-Val),Synthetic,"Water, aqueous buffers",Melanocortin fragment peptide,KPV Reference Standard | Melanocortin Fragment,"α-MSH(11–13) fragment (Lys-Pro-Val) for in-vitro melanocortin receptor and inflammatory-signalling research. Lyophilized peptide, ≥95–98% HPLC. RUO.",What is the structural origin of KPV?,KPV corresponds to the C‑terminal three residues (11–13) of α‑MSH and represents a minimal melanocortin-related peptide fragment.,Which research areas commonly employ KPV?,It is used in studies of melanocortin receptor engagement and in in‑vitro models assessing inflammatory-signalling markers and epithelial responses.,How is KPV typically supplied and stored?,"Vendors provide KPV as a synthetic, lyophilized tripeptide with high HPLC purity, stored at −20°C and reconstituted in aqueous media before experiments.",,,,,"Getting S.J. et al., 2004. α‑MSH tripeptide analogs activate melanocortin 1 receptor and modulate inflammatory responses. J Pharmacol Exp Ther.","NovoPro Bioscience product sheet for α‑MSH(11–13)/KPV, including sequence and analytical data.",
